{
  "schema_version": "2026-05-29",
  "document_type": "appointment",
  "tenant_id": "tenant_demo",
  "appointment_id": "appt_demo123",
  "service_id": "svc_60_min_massage",
  "service_name": "1 hour full body massage",
  "starts_at": "2026-06-01T14:00:00-06:00",
  "ends_at": "2026-06-01T15:00:00-06:00",
  "timezone": "America/Denver",
  "status": "booked",
  "payment_status": "paid",
  "assigned_fulfiller_id": "fulfiller_george_platinum",
  "customer": {
    "customer_id": "cus_local_marco_rubio",
    "name": "Marco Rubio",
    "email": "mrubio@gmail.com",
    "phone": "12135551212"
  },
  "price": {
    "currency": "usd",
    "unit_amount": 12000
  },
  "service_location": {},
  "rule_snapshot": {
    "check_in_required": false,
    "completion_required": true
  },
  "manage_token_ref": "kms://appointment-token-demo",
  "checked_in_at": null,
  "completed_at": null,
  "canceled_at": null,
  "created_at": 1780092000,
  "updated_at": 1780092000
}
